commit	cells	proof	status	description
b069e6f	40	PASS	keep	baseline: naive ripple-carry, xor expanded to and/or/not, 3-product majority carry
202d1fb	34	PASS	keep	xor-native full adder: sum=a^b^c, carry=(a&b)|(c&(a^b))
bd5cd16	0	FAIL	discard	g/p carry chain with p=a|b reused as half-sum — counterexample a=255 b=255 (p^c wrong when a=b=1)
37cd677	40	PASS	discard	or-propagate carry (a&b)|((a|b)&c) — correct but +6 cells: loses shared a^b between sum and carry
404e862	34	PASS	discard	hand-folded bit-0 constant carry — tie at 34 (yosys already const-folds), more verbose source
3e1f4a6	34	PASS	discard	mux-form sum (c&~h)|(~c&h) — ABC re-derives the xor, tie at 34, xor form simpler
0a222f5	105	PASS	keep	ALU baseline: 4 independent datapaths (adder, subtractor, and, xor) + mux tree
9767615	91	PASS	keep	STRUCTURAL: deleted subtractor datapath — shared adder a+(b^isSub)+isSub, arith mux leg collapsed
ce2db96	77	PASS	keep	DONT-CARE: isSub=op0 alone — arith leg unselected when op1=1, prover certifies the exploitation
75bbdc9	175	PASS	keep	ALU2 baseline: 8 independent datapaths, two dedicated comparator chains, 3-level mux tree
e851814	180	PASS	discard	fused add/sub alone — correct but +5: bEff=b^isSub breaks ABC sharing of a^b,a&b with logic/compare paths
3021f6b	157	PASS	keep	UNIFIED CORE: add/sub/sltu(=not carry8)/slt(=N xor V) share ONE carry chain; both comparator chains deleted
8566406	0	FAIL	discard	slt=sign(a-b) w/o overflow fix — counterexample op=6 a=175 b=106 (a-b=-187 overflows, sign bit lies)
